{
  "schemaVersion": 1,
  "generatedAt": "2026-09-01T17:08:06.125Z",
  "minPublishableSamples": 10,
  "minPublishableVendors": 2,
  "publishable": false,
  "sampleCount": 0,
  "vendors": [],
  "asOf": "2026-09-01",
  "totalUsage": {
    "inputUncached": {
      "p25": 0,
      "p50": 0,
      "p75": 0
    },
    "cacheRead": {
      "p25": 0,
      "p50": 0,
      "p75": 0
    },
    "cacheCreation": {
      "p25": 0,
      "p50": 0,
      "p75": 0
    },
    "output": {
      "p25": 0,
      "p50": 0,
      "p75": 0
    },
    "reasoning": {
      "p25": 0,
      "p50": 0,
      "p75": 0
    }
  },
  "stageUsage": [],
  "compactionCount": {
    "p25": 0,
    "p50": 0,
    "p75": 0
  },
  "cacheHitRatio": 0,
  "successRateByModel": {},
  "successRateByVendor": {}
}
